[
  {
    "family": "devonthink-add",
    "canonical_tool": "devonthink-add-custom-meta-data",
    "members": [
      "add-custom-meta-data",
      "add-download",
      "add-reading-list",
      "add-reminder",
      "add-row",
      "devonthink-add-custom-meta-data",
      "devonthink-add-download",
      "devonthink-add-reading-list",
      "devonthink-add-reminder",
      "devonthink-add-row"
    ],
    "note": "DEVONthink overlap family grouped by command verb for devonthink-add."
  },
  {
    "family": "devonthink-annotation-note",
    "canonical_tool": "devonthink-create-annotation-note",
    "members": [
      "devonthink-create-annotation-note",
      "devonthink-read-annotation-note"
    ],
    "note": "Overlap family for devonthink-annotation-note."
  },
  {
    "family": "devonthink-annotation-summary",
    "canonical_tool": "devonthink-summarize-annotations",
    "members": [
      "devonthink-summarize-annotations"
    ],
    "note": "Overlap family for devonthink-annotation-summary."
  },
  {
    "family": "devonthink-bold",
    "canonical_tool": "devonthink-bold",
    "members": [
      "bold",
      "devonthink-bold"
    ],
    "note": "DEVONthink overlap family grouped by command verb for devonthink-bold."
  },
  {
    "family": "devonthink-check",
    "canonical_tool": "devonthink-check-file-integrity-of",
    "members": [
      "check-file-integrity-of",
      "devonthink-check-file-integrity-of"
    ],
    "note": "DEVONthink overlap family grouped by command verb for devonthink-check."
  },
  {
    "family": "devonthink-classify",
    "canonical_tool": "devonthink-classify",
    "members": [
      "classify",
      "devonthink-classify"
    ],
    "note": "DEVONthink overlap family grouped by command verb for devonthink-classify."
  },
  {
    "family": "devonthink-close",
    "canonical_tool": "devonthink-close",
    "members": [
      "close",
      "devonthink-close"
    ],
    "note": "DEVONthink overlap family grouped by command verb for devonthink-close."
  },
  {
    "family": "devonthink-compare",
    "canonical_tool": "devonthink-compare",
    "members": [
      "compare",
      "devonthink-compare"
    ],
    "note": "DEVONthink overlap family grouped by command verb for devonthink-compare."
  },
  {
    "family": "devonthink-compress",
    "canonical_tool": "devonthink-compress",
    "members": [
      "compress",
      "devonthink-compress"
    ],
    "note": "DEVONthink overlap family grouped by command verb for devonthink-compress."
  },
  {
    "family": "devonthink-convert",
    "canonical_tool": "devonthink-convert",
    "members": [
      "convert",
      "convert-feed-to-html",
      "convert-image",
      "devonthink-convert",
      "devonthink-convert-feed-to-html",
      "devonthink-convert-image"
    ],
    "note": "DEVONthink overlap family grouped by command verb for devonthink-convert."
  },
  {
    "family": "devonthink-count",
    "canonical_tool": "devonthink-count",
    "members": [
      "count",
      "devonthink-count"
    ],
    "note": "DEVONthink overlap family grouped by command verb for devonthink-count."
  },
  {
    "family": "devonthink-create",
    "canonical_tool": "devonthink-create-database",
    "members": [
      "create-database",
      "create-formatted-note-from",
      "create-location",
      "create-markdown-from",
      "create-pdf-document-from",
      "create-record",
      "create-record-with",
      "create-thumbnail",
      "create-web-document-from",
      "devonthink-add-record",
      "devonthink-create-database",
      "devonthink-create-formatted-note-from",
      "devonthink-create-location",
      "devonthink-create-markdown-from",
      "devonthink-create-pdf-document-from",
      "devonthink-create-record",
      "devonthink-create-record-with",
      "devonthink-create-thumbnail",
      "devonthink-create-web-document-from"
    ],
    "note": "DEVONthink overlap family grouped by command verb for devonthink-create."
  },
  {
    "family": "devonthink-database",
    "canonical_tool": "devonthink-close-database",
    "members": [
      "devonthink-close-database",
      "devonthink-list-databases",
      "devonthink-open-database",
      "devonthink-sync-database",
      "devonthink-verify-database"
    ],
    "note": "Overlap family for devonthink-database."
  },
  {
    "family": "devonthink-delete",
    "canonical_tool": "devonthink-delete",
    "members": [
      "delete",
      "delete-row-at",
      "delete-thumbnail",
      "delete-workspace",
      "devonthink-delete",
      "devonthink-delete-row-at",
      "devonthink-delete-thumbnail",
      "devonthink-delete-workspace"
    ],
    "note": "DEVONthink overlap family grouped by command verb for devonthink-delete."
  },
  {
    "family": "devonthink-display",
    "canonical_tool": "devonthink-display-authentication-dialog",
    "members": [
      "devonthink-display-authentication-dialog",
      "devonthink-display-date-editor",
      "devonthink-display-group-selector",
      "devonthink-display-name-editor",
      "display-authentication-dialog",
      "display-date-editor",
      "display-group-selector",
      "display-name-editor"
    ],
    "note": "DEVONthink overlap family grouped by command verb for devonthink-display."
  },
  {
    "family": "devonthink-do",
    "canonical_tool": "devonthink-do-javascript",
    "members": [
      "devonthink-do-javascript",
      "do-javascript"
    ],
    "note": "DEVONthink overlap family grouped by command verb for devonthink-do."
  },
  {
    "family": "devonthink-download",
    "canonical_tool": "devonthink-download-json-from",
    "members": [
      "devonthink-download-json-from",
      "devonthink-download-markup-from",
      "devonthink-download-url",
      "download-json-from",
      "download-markup-from",
      "download-url"
    ],
    "note": "DEVONthink overlap family grouped by command verb for devonthink-download."
  },
  {
    "family": "devonthink-duplicate",
    "canonical_tool": "devonthink-duplicate",
    "members": [
      "devonthink-duplicate",
      "devonthink-duplicate-record",
      "duplicate"
    ],
    "note": "DEVONthink overlap family grouped by command verb for devonthink-duplicate."
  },
  {
    "family": "devonthink-exists",
    "canonical_tool": "devonthink-exists",
    "members": [
      "devonthink-exists",
      "devonthink-exists-record-at",
      "devonthink-exists-record-with-comment",
      "devonthink-exists-record-with-content-hash",
      "devonthink-exists-record-with-file",
      "devonthink-exists-record-with-path",
      "devonthink-exists-record-with-url",
      "exists",
      "exists-record-at",
      "exists-record-with-comment",
      "exists-record-with-content-hash",
      "exists-record-with-file",
      "exists-record-with-path",
      "exists-record-with-url"
    ],
    "note": "DEVONthink overlap family grouped by command verb for devonthink-exists."
  },
  {
    "family": "devonthink-export",
    "canonical_tool": "devonthink-export",
    "members": [
      "devonthink-export",
      "devonthink-export-tags-of",
      "devonthink-export-website",
      "export",
      "export-tags-of",
      "export-website"
    ],
    "note": "DEVONthink overlap family grouped by command verb for devonthink-export."
  },
  {
    "family": "devonthink-extract",
    "canonical_tool": "devonthink-extract-keywords-from",
    "members": [
      "devonthink-extract-keywords-from",
      "extract-keywords-from"
    ],
    "note": "DEVONthink overlap family grouped by command verb for devonthink-extract."
  },
  {
    "family": "devonthink-get",
    "canonical_tool": "devonthink-get-cached-data-for-url",
    "members": [
      "devonthink-get-cached-data-for-url",
      "devonthink-get-cell-at",
      "devonthink-get-concordance-of",
      "devonthink-get-custom-meta-data",
      "devonthink-get-database",
      "devonthink-get-database-by-uuid",
      "devonthink-get-database-incoming-group",
      "devonthink-get-database-with-id",
      "devonthink-get-database-with-uuid",
      "devonthink-get-embedded-images-of",
      "devonthink-get-embedded-objects-of",
      "devonthink-get-embedded-sheets-and-scripts-of",
      "devonthink-get-favicon-of",
      "devonthink-get-feed-items-of",
      "devonthink-get-frames-of",
      "devonthink-get-items-of-feed",
      "devonthink-get-links-of",
      "devonthink-get-metadata-of",
      "devonthink-get-record",
      "devonthink-get-record-at",
      "devonthink-get-record-by-uuid",
      "devonthink-get-record-with-id",
      "devonthink-get-record-with-uuid",
      "devonthink-get-rich-text-of",
      "devonthink-get-text-of",
      "devonthink-get-title-of",
      "devonthink-get-versions-of",
      "devonthink-list-group-children",
      "devonthink-read-record-text",
      "get-cached-data-for-url",
      "get-cell-at",
      "get-concordance-of",
      "get-custom-meta-data",
      "get-database-by-uuid",
      "get-database-with-id",
      "get-database-with-uuid",
      "get-embedded-images-of",
      "get-embedded-objects-of",
      "get-embedded-sheets-and-scripts-of",
      "get-favicon-of",
      "get-feed-items-of",
      "get-frames-of",
      "get-items-of-feed",
      "get-links-of",
      "get-metadata-of",
      "get-record-at",
      "get-record-by-uuid",
      "get-record-with-id",
      "get-record-with-uuid",
      "get-rich-text-of",
      "get-text-of",
      "get-title-of",
      "get-versions-of"
    ],
    "note": "DEVONthink overlap family grouped by command verb for devonthink-get."
  },
  {
    "family": "devonthink-hide",
    "canonical_tool": "devonthink-hide-progress-indicator",
    "members": [
      "devonthink-hide-progress-indicator",
      "hide-progress-indicator"
    ],
    "note": "DEVONthink overlap family grouped by command verb for devonthink-hide."
  },
  {
    "family": "devonthink-import",
    "canonical_tool": "devonthink-import-attachments-of",
    "members": [